1279	Incomplete	Cryptographic Primitives used without Successful Self-Test
1280	Incomplete	Access Control Check Implemented After Asset is Accessed
1281	Incomplete	Sequence of Processor Instructions Leads to Unexpected Behavior (Halt and Catch Fire)
1282	Incomplete	Assumed-Immutable Data Stored in Writable Memory
1283	Incomplete	Mutable Attestation or Measurement Reporting Data
1284	Incomplete	Improper Validation of Specified Quantity in Input
1285	Incomplete	Improper Validation of Specified Index, Position, or Offset in Input
1286	Incomplete	Improper Validation of Syntactic Correctness of Input
1287	Incomplete	Improper Validation of Specified Type of Input
1288	Incomplete	Improper Validation of Consistency within Input
1289	Incomplete	Improper Validation of Unsafe Equivalence in Input
