5	Draft	J2EE Misconfiguration: Data Transmission Without Encryption
6	Incomplete	J2EE Misconfiguration: Insufficient Session-ID Length
7	Incomplete	J2EE Misconfiguration: Missing Custom Error Page
8	Incomplete	J2EE Misconfiguration: Entity Bean Declared Remote
9	Draft	J2EE Misconfiguration: Weak Access Permissions for EJB Methods
11	Draft	ASP.NET Misconfiguration: Creating Debug Binary
12	Draft	ASP.NET Misconfiguration: Missing Custom Error Page
13	Draft	ASP.NET Misconfiguration: Password in Configuration File
14	Draft	Compiler Removal of Code to Clear Buffers
15	Incomplete	External Control of System or Configuration Setting
20	Stable	Improper Input Validation
22	Stable	Improper Limitation of a Pathname to a Restricted Directory ('Path Traversal')
23	Draft	Relative Path Traversal
24	Incomplete	Path Traversal: '../filedir'
25	Incomplete	Path Traversal: '/../filedir'
26	Draft	Path Traversal: '/dir/../filename'
27	Draft	Path Traversal: 'dir/../../filename'
28	Incomplete	Path Traversal: '..\filedir'
29	Incomplete	Path Traversal: '\..\filename'
30	Draft	Path Traversal: '\dir\..\filename'
31	Draft	Path Traversal: 'dir\..\..\filename'
32	Incomplete	Path Traversal: '...' (Triple Dot)
33	Incomplete	Path Traversal: '....' (Multiple Dot)
34	Incomplete	Path Traversal: '....//'
35	Incomplete	Path Traversal: '.../...//'
36	Draft	Absolute Path Traversal
37	Draft	Path Traversal: '/absolute/pathname/here'
38	Draft	Path Traversal: '\absolute\pathname\here'
39	Draft	Path Traversal: 'C:dirname'
40	Draft	Path Traversal: '\\UNC\share\name\' (Windows UNC Share)
41	Incomplete	Improper Resolution of Path Equivalence
42	Incomplete	Path Equivalence: 'filename.' (Trailing Dot)
43	Incomplete	Path Equivalence: 'filename....' (Multiple Trailing Dot)
44	Incomplete	Path Equivalence: 'file.name' (Internal Dot)
45	Incomplete	Path Equivalence: 'file...name' (Multiple Internal Dot)
46	Incomplete	Path Equivalence: 'filename ' (Trailing Space)
47	Incomplete	Path Equivalence: ' filename' (Leading Space)
48	Incomplete	Path Equivalence: 'file name' (Internal Whitespace)
49	Incomplete	Path Equivalence: 'filename/' (Trailing Slash)
50	Incomplete	Path Equivalence: '//multiple/leading/slash'
51	Incomplete	Path Equivalence: '/multiple//internal/slash'
52	Incomplete	Path Equivalence: '/multiple/trailing/slash//'
53	Incomplete	Path Equivalence: '\multiple\\internal\backslash'
54	Incomplete	Path Equivalence: 'filedir\' (Trailing Backslash)
55	Incomplete	Path Equivalence: '/./' (Single Dot Directory)
56	Incomplete	Path Equivalence: 'filedir*' (Wildcard)
57	Incomplete	Path Equivalence: 'fakedir/../realdir/filename'
58	Incomplete	Path Equivalence: Windows 8.3 Filename
59	Draft	Improper Link Resolution Before File Access ('Link Following')
61	Incomplete	UNIX Symbolic Link (Symlink) Following
62	Incomplete	UNIX Hard Link
64	Incomplete	Windows Shortcut Following (.LNK)
65	Incomplete	Windows Hard Link
66	Draft	Improper Handling of File Names that Identify Virtual Resources
67	Incomplete	Improper Handling of Windows Device Names
69	Incomplete	Improper Handling of Windows ::DATA Alternate Data Stream
71	Deprecated	DEPRECATED: Apple '.DS_Store'
72	Incomplete	Improper Handling of Apple HFS+ Alternate Data Stream Path
73	Draft	External Control of File Name or Path
74	Incomplete	Improper Neutralization of Special Elements in Output Used by a Downstream Component ('Injection')
75	Draft	Failure to Sanitize Special Elements into a Different Plane (Special Element Injection)
76	Draft	Improper Neutralization of Equivalent Special Elements
77	Draft	Improper Neutralization of Special Elements used in a Command ('Command Injection')
78	Stable	Improper Neutralization of Special Elements used in an OS Command ('OS Command Injection')
79	Stable	Improper Neutralization of Input During Web Page Generation ('Cross-site Scripting')
80	Incomplete	Improper Neutralization of Script-Related HTML Tags in a Web Page (Basic XSS)
81	Incomplete	Improper Neutralization of Script in an Error Message Web Page
82	Incomplete	Improper Neutralization of Script in Attributes of IMG Tags in a Web Page
83	Draft	Improper Neutralization of Script in Attributes in a Web Page
84	Draft	Improper Neutralization of Encoded URI Schemes in a Web Page
85	Draft	Doubled Character XSS Manipulations
86	Draft	Improper Neutralization of Invalid Characters in Identifiers in Web Pages
87	Draft	Improper Neutralization of Alternate XSS Syntax
88	Draft	Improper Neutralization of Argument Delimiters in a Command ('Argument Injection')
89	Stable	Improper Neutralization of Special Elements used in an SQL Command ('SQL Injection')
90	Draft	Improper Neutralization of Special Elements used in an LDAP Query ('LDAP Injection')
91	Draft	XML Injection (aka Blind XPath Injection)
92	Deprecated	DEPRECATED: Improper Sanitization of Custom Special Characters
93	Draft	Improper Neutralization of CRLF Sequences ('CRLF Injection')
94	Draft	Improper Control of Generation of Code ('Code Injection')
95	Incomplete	Improper Neutralization of Directives in Dynamically Evaluated Code ('Eval Injection')
96	Draft	Improper Neutralization of Directives in Statically Saved Code ('Static Code Injection')
97	Draft	Improper Neutralization of Server-Side Includes (SSI) Within a Web Page
98	Draft	Improper Control of Filename for Include/Require Statement in PHP Program ('PHP Remote File Inclusion')
99	Draft	Improper Control of Resource Identifiers ('Resource Injection')
102	Incomplete	Struts: Duplicate Validation Forms
103	Draft	Struts: Incomplete validate() Method Definition
104	Draft	Struts: Form Bean Does Not Extend Validation Class
105	Draft	Struts: Form Field Without Validator
106	Draft	Struts: Plug-in Framework not in Use
107	Draft	Struts: Unused Validation Form
108	Incomplete	Struts: Unvalidated Action Form
109	Draft	Struts: Validator Turned Off
110	Draft	Struts: Validator Without Form Field
111	Draft	Direct Use of Unsafe JNI
112	Draft	Missing XML Validation
113	Incomplete	Improper Neutralization of CRLF Sequences in HTTP Headers ('HTTP Response Splitting')
114	Incomplete	Process Control
115	Incomplete	Misinterpretation of Input
116	Draft	Improper Encoding or Escaping of Output
117	Draft	Improper Output Neutralization for Logs
118	Incomplete	Incorrect Access of Indexable Resource ('Range Error')
119	Stable	Improper Restriction of Operations within the Bounds of a Memory Buffer
120	Incomplete	Buffer Copy without Checking Size of Input ('Classic Buffer Overflow')
121	Draft	Stack-based Buffer Overflow
122	Draft	Heap-based Buffer Overflow
123	Draft	Write-what-where Condition
124	Incomplete	Buffer Underwrite ('Buffer Underflow')
125	Draft	Out-of-bounds Read
126	Draft	Buffer Over-read
127	Draft	Buffer Under-read
128	Incomplete	Wrap-around Error
129	Draft	Improper Validation of Array Index
130	Incomplete	Improper Handling of Length Parameter Inconsistency
131	Draft	Incorrect Calculation of Buffer Size
132	Deprecated	DEPRECATED (Duplicate): Miscalculated Null Termination
134	Draft	Use of Externally-Controlled Format String
135	Draft	Incorrect Calculation of Multi-Byte String Length
138	Draft	Improper Neutralization of Special Elements
140	Draft	Improper Neutralization of Delimiters
141	Draft	Improper Neutralization of Parameter/Argument Delimiters
142	Draft	Improper Neutralization of Value Delimiters
143	Draft	Improper Neutralization of Record Delimiters
144	Draft	Improper Neutralization of Line Delimiters
145	Incomplete	Improper Neutralization of Section Delimiters
146	Incomplete	Improper Neutralization of Expression/Command Delimiters
147	Draft	Improper Neutralization of Input Terminators
148	Draft	Improper Neutralization of Input Leaders
149	Draft	Improper Neutralization of Quoting Syntax
150	Incomplete	Improper Neutralization of Escape, Meta, or Control Sequences
151	Draft	Improper Neutralization of Comment Delimiters
152	Draft	Improper Neutralization of Macro Symbols
153	Draft	Improper Neutralization of Substitution Characters
154	Incomplete	Improper Neutralization of Variable Name Delimiters
155	Draft	Improper Neutralization of Wildcards or Matching Symbols
156	Draft	Improper Neutralization of Whitespace
157	Draft	Failure to Sanitize Paired Delimiters
158	Incomplete	Improper Neutralization of Null Byte or NUL Character
159	Draft	Improper Handling of Invalid Use of Special Elements
160	Incomplete	Improper Neutralization of Leading Special Elements
161	Incomplete	Improper Neutralization of Multiple Leading Special Elements
162	Incomplete	Improper Neutralization of Trailing Special Elements
163	Incomplete	Improper Neutralization of Multiple Trailing Special Elements
164	Incomplete	Improper Neutralization of Internal Special Elements
165	Incomplete	Improper Neutralization of Multiple Internal Special Elements
166	Draft	Improper Handling of Missing Special Element
167	Draft	Improper Handling of Additional Special Element
168	Draft	Improper Handling of Inconsistent Special Elements
170	Incomplete	Improper Null Termination
172	Draft	Encoding Error
173	Draft	Improper Handling of Alternate Encoding
174	Draft	Double Decoding of the Same Data
175	Draft	Improper Handling of Mixed Encoding
176	Draft	Improper Handling of Unicode Encoding
177	Draft	Improper Handling of URL Encoding (Hex Encoding)
178	Incomplete	Improper Handling of Case Sensitivity
179	Incomplete	Incorrect Behavior Order: Early Validation
180	Draft	Incorrect Behavior Order: Validate Before Canonicalize
181	Draft	Incorrect Behavior Order: Validate Before Filter
182	Draft	Collapse of Data into Unsafe Value
183	Draft	Permissive List of Allowed Inputs
184	Draft	Incomplete List of Disallowed Inputs
185	Draft	Incorrect Regular Expression
186	Draft	Overly Restrictive Regular Expression
187	Incomplete	Partial String Comparison
188	Draft	Reliance on Data/Memory Layout
190	Stable	Integer Overflow or Wraparound
191	Draft	Integer Underflow (Wrap or Wraparound)
192	Incomplete	Integer Coercion Error
193	Draft	Off-by-one Error
194	Incomplete	Unexpected Sign Extension
195	Draft	Signed to Unsigned Conversion Error
196	Draft	Unsigned to Signed Conversion Error
197	Incomplete	Numeric Truncation Error
198	Draft	Use of Incorrect Byte Ordering
200	Draft	Exposure of Sensitive Information to an Unauthorized Actor
201	Draft	Exposure of Sensitive Information Through Sent Data
202	Draft	Exposure of Sensitive Information Through Data Queries
203	Incomplete	Observable Discrepancy
204	Incomplete	Observable Response Discrepancy
205	Incomplete	Observable Behavioral Discrepancy
206	Incomplete	Observable Internal Behavioral Discrepancy
207	Draft	Observable Behavioral Discrepancy With Equivalent Products
208	Incomplete	Observable Timing Discrepancy
209	Draft	Generation of Error Message Containing Sensitive Information
210	Draft	Self-generated Error Message Containing Sensitive Information
211	Incomplete	Externally-Generated Error Message Containing Sensitive Information
212	Incomplete	Improper Removal of Sensitive Information Before Storage or Transfer
213	Draft	Exposure of Sensitive Information Due to Incompatible Policies
214	Incomplete	Invocation of Process Using Visible Sensitive Information
215	Draft	Insertion of Sensitive Information Into Debugging Code
216	Deprecated	DEPRECATED: Containment Errors (Container Errors)
217	Deprecated	DEPRECATED: Failure to Protect Stored Data from Modification
218	Deprecated	DEPRECATED (Duplicate): Failure to provide confidentiality for stored data
219	Draft	Storage of File with Sensitive Data Under Web Root
220	Draft	Storage of File With Sensitive Data Under FTP Root
221	Incomplete	Information Loss or Omission
222	Draft	Truncation of Security-relevant Information
223	Draft	Omission of Security-relevant Information
224	Incomplete	Obscured Security-relevant Information by Alternate Name
225	Deprecated	DEPRECATED (Duplicate): General Information Management Problems
226	Draft	Sensitive Information Uncleared in Resource Before Release for Reuse
228	Incomplete	Improper Handling of Syntactically Invalid Structure
229	Incomplete	Improper Handling of Values
230	Draft	Improper Handling of Missing Values
231	Draft	Improper Handling of Extra Values
232	Draft	Improper Handling of Undefined Values
233	Incomplete	Improper Handling of Parameters
234	Incomplete	Failure to Handle Missing Parameter
235	Draft	Improper Handling of Extra Parameters
236	Draft	Improper Handling of Undefined Parameters
237	Incomplete	Improper Handling of Structural Elements
238	Draft	Improper Handling of Incomplete Structural Elements
239	Draft	Failure to Handle Incomplete Element
240	Draft	Improper Handling of Inconsistent Structural Elements
241	Draft	Improper Handling of Unexpected Data Type
242	Draft	Use of Inherently Dangerous Function
243	Draft	Creation of chroot Jail Without Changing Working Directory
244	Draft	Improper Clearing of Heap Memory Before Release ('Heap Inspection')
245	Draft	J2EE Bad Practices: Direct Management of Connections
246	Draft	J2EE Bad Practices: Direct Use of Sockets
247	Deprecated	DEPRECATED (Duplicate): Reliance on DNS Lookups in a Security Decision
248	Draft	Uncaught Exception
249	Deprecated	DEPRECATED: Often Misused: Path Manipulation
250	Draft	Execution with Unnecessary Privileges
252	Draft	Unchecked Return Value
253	Incomplete	Incorrect Check of Function Return Value
256	Incomplete	Unprotected Storage of Credentials
257	Incomplete	Storing Passwords in a Recoverable Format
258	Incomplete	Empty Password in Configuration File
259	Draft	Use of Hard-coded Password
260	Incomplete	Password in Configuration File
261	Incomplete	Weak Encoding for Password
262	Draft	Not Using Password Aging
263	Draft	Password Aging with Long Expiration
266	Draft	Incorrect Privilege Assignment
267	Incomplete	Privilege Defined With Unsafe Actions
268	Draft	Privilege Chaining
269	Draft	Improper Privilege Management
270	Draft	Privilege Context Switching Error
271	Incomplete	Privilege Dropping / Lowering Errors
272	Incomplete	Least Privilege Violation
273	Incomplete	Improper Check for Dropped Privileges
274	Draft	Improper Handling of Insufficient Privileges
276	Draft	Incorrect Default Permissions
277	Draft	Insecure Inherited Permissions
278	Incomplete	Insecure Preserved Inherited Permissions
279	Draft	Incorrect Execution-Assigned Permissions
280	Draft	Improper Handling of Insufficient Permissions or Privileges 
281	Draft	Improper Preservation of Permissions
282	Draft	Improper Ownership Management
283	Draft	Unverified Ownership
284	Incomplete	Improper Access Control
285	Draft	Improper Authorization
286	Incomplete	Incorrect User Management
287	Draft	Improper Authentication
288	Incomplete	Authentication Bypass Using an Alternate Path or Channel
289	Incomplete	Authentication Bypass by Alternate Name
290	Incomplete	Authentication Bypass by Spoofing
291	Incomplete	Reliance on IP Address for Authentication
292	Deprecated	DEPRECATED (Duplicate): Trusting Self-reported DNS Name
293	Draft	Using Referer Field for Authentication
294	Incomplete	Authentication Bypass by Capture-replay
295	Draft	Improper Certificate Validation
296	Draft	Improper Following of a Certificate's Chain of Trust
297	Incomplete	Improper Validation of Certificate with Host Mismatch
298	Draft	Improper Validation of Certificate Expiration
299	Draft	Improper Check for Certificate Revocation
300	Draft	Channel Accessible by Non-Endpoint
301	Draft	Reflection Attack in an Authentication Protocol
302	Incomplete	Authentication Bypass by Assumed-Immutable Data
303	Draft	Incorrect Implementation of Authentication Algorithm
304	Draft	Missing Critical Step in Authentication
305	Draft	Authentication Bypass by Primary Weakness
306	Draft	Missing Authentication for Critical Function
307	Draft	Improper Restriction of Excessive Authentication Attempts
308	Draft	Use of Single-factor Authentication
309	Draft	Use of Password System for Primary Authentication
311	Draft	Missing Encryption of Sensitive Data
312	Draft	Cleartext Storage of Sensitive Information
313	Draft	Cleartext Storage in a File or on Disk
314	Draft	Cleartext Storage in the Registry
315	Draft	Cleartext Storage of Sensitive Information in a Cookie
316	Draft	Cleartext Storage of Sensitive Information in Memory
317	Draft	Cleartext Storage of Sensitive Information in GUI
318	Draft	Cleartext Storage of Sensitive Information in Executable
319	Draft	Cleartext Transmission of Sensitive Information
321	Draft	Use of Hard-coded Cryptographic Key
322	Draft	Key Exchange without Entity Authentication
323	Incomplete	Reusing a Nonce, Key Pair in Encryption
324	Draft	Use of a Key Past its Expiration Date
325	Draft	Missing Required Cryptographic Step
326	Draft	Inadequate Encryption Strength
327	Draft	Use of a Broken or Risky Cryptographic Algorithm
328	Draft	Reversible One-Way Hash
329	Draft	Not Using a Random IV with CBC Mode
330	Stable	Use of Insufficiently Random Values
331	Draft	Insufficient Entropy
332	Draft	Insufficient Entropy in PRNG
333	Draft	Improper Handling of Insufficient Entropy in TRNG
334	Draft	Small Space of Random Values
335	Draft	Incorrect Usage of Seeds in Pseudo-Random Number Generator (PRNG)
336	Draft	Same Seed in Pseudo-Random Number Generator (PRNG)
337	Draft	Predictable Seed in Pseudo-Random Number Generator (PRNG)
338	Draft	Use of Cryptographically Weak Pseudo-Random Number Generator (PRNG)
339	Draft	Small Seed Space in PRNG
340	Incomplete	Generation of Predictable Numbers or Identifiers
341	Draft	Predictable from Observable State
342	Draft	Predictable Exact Value from Previous Values
343	Draft	Predictable Value Range from Previous Values
344	Draft	Use of Invariant Value in Dynamically Changing Context
345	Draft	Insufficient Verification of Data Authenticity
346	Draft	Origin Validation Error
347	Draft	Improper Verification of Cryptographic Signature
348	Draft	Use of Less Trusted Source
349	Draft	Acceptance of Extraneous Untrusted Data With Trusted Data
350	Draft	Reliance on Reverse DNS Resolution for a Security-Critical Action
351	Draft	Insufficient Type Distinction
352	Stable	Cross-Site Request Forgery (CSRF)
353	Draft	Missing Support for Integrity Check
354	Draft	Improper Validation of Integrity Check Value
356	Incomplete	Product UI does not Warn User of Unsafe Actions
357	Draft	Insufficient UI Warning of Dangerous Operations
358	Draft	Improperly Implemented Security Check for Standard
359	Incomplete	Exposure of Private Personal Information to an Unauthorized Actor
360	Incomplete	Trust of System Event Data
362	Draft	Concurrent Execution using Shared Resource with Improper Synchronization ('Race Condition')
363	Draft	Race Condition Enabling Link Following
364	Incomplete	Signal Handler Race Condition
365	Draft	Race Condition in Switch
366	Draft	Race Condition within a Thread
367	Incomplete	Time-of-check Time-of-use (TOCTOU) Race Condition
368	Draft	Context Switching Race Condition
369	Draft	Divide By Zero
370	Draft	Missing Check for Certificate Revocation after Initial Check
372	Draft	Incomplete Internal State Distinction
373	Deprecated	DEPRECATED: State Synchronization Error
374	Draft	Passing Mutable Objects to an Untrusted Method
375	Draft	Returning a Mutable Object to an Untrusted Caller
377	Incomplete	Insecure Temporary File
378	Draft	Creation of Temporary File With Insecure Permissions
379	Incomplete	Creation of Temporary File in Directory with Insecure Permissions
382	Draft	J2EE Bad Practices: Use of System.exit()
383	Draft	J2EE Bad Practices: Direct Use of Threads
384	Incomplete	Session Fixation
385	Incomplete	Covert Timing Channel
386	Draft	Symbolic Name not Mapping to Correct Object
390	Draft	Detection of Error Condition Without Action
391	Incomplete	Unchecked Error Condition
392	Draft	Missing Report of Error Condition
393	Draft	Return of Wrong Status Code
394	Draft	Unexpected Status Code or Return Value
395	Draft	Use of NullPointerException Catch to Detect NULL Pointer Dereference
396	Draft	Declaration of Catch for Generic Exception
397	Draft	Declaration of Throws for Generic Exception
400	Draft	Uncontrolled Resource Consumption
401	Draft	Missing Release of Memory after Effective Lifetime
402	Draft	Transmission of Private Resources into a New Sphere ('Resource Leak')
403	Draft	Exposure of File Descriptor to Unintended Control Sphere ('File Descriptor Leak')
404	Draft	Improper Resource Shutdown or Release
405	Incomplete	Asymmetric Resource Consumption (Amplification)
406	Incomplete	Insufficient Control of Network Message Volume (Network Amplification)
407	Incomplete	Inefficient Algorithmic Complexity
408	Draft	Incorrect Behavior Order: Early Amplification
409	Incomplete	Improper Handling of Highly Compressed Data (Data Amplification)
410	Incomplete	Insufficient Resource Pool
412	Incomplete	Unrestricted Externally Accessible Lock
413	Draft	Improper Resource Locking
414	Draft	Missing Lock Check
415	Draft	Double Free
416	Stable	Use After Free
419	Draft	Unprotected Primary Channel
420	Draft	Unprotected Alternate Channel
421	Draft	Race Condition During Access to Alternate Channel
422	Draft	Unprotected Windows Messaging Channel ('Shatter')
423	Deprecated	DEPRECATED (Duplicate): Proxied Trusted Channel
424	Draft	Improper Protection of Alternate Path
425	Incomplete	Direct Request ('Forced Browsing')
426	Stable	Untrusted Search Path
427	Draft	Uncontrolled Search Path Element
428	Draft	Unquoted Search Path or Element
430	Incomplete	Deployment of Wrong Handler
431	Draft	Missing Handler
432	Draft	Dangerous Signal Handler not Disabled During Sensitive Operations
433	Incomplete	Unparsed Raw Web Content Delivery
434	Draft	Unrestricted Upload of File with Dangerous Type
435	Draft	Improper Interaction Between Multiple Correctly-Behaving Entities
436	Incomplete	Interpretation Conflict
437	Incomplete	Incomplete Model of Endpoint Features
439	Draft	Behavioral Change in New Version or Environment
440	Draft	Expected Behavior Violation
441	Draft	Unintended Proxy or Intermediary ('Confused Deputy')
443	Deprecated	DEPRECATED (Duplicate): HTTP response splitting
444	Incomplete	Inconsistent Interpretation of HTTP Requests ('HTTP Request Smuggling')
446	Incomplete	UI Discrepancy for Security Feature
447	Draft	Unimplemented or Unsupported Feature in UI
448	Draft	Obsolete Feature in UI
449	Incomplete	The UI Performs the Wrong Action
450	Draft	Multiple Interpretations of UI Input
451	Draft	User Interface (UI) Misrepresentation of Critical Information
453	Draft	Insecure Default Variable Initialization
454	Draft	External Initialization of Trusted Variables or Data Stores
455	Draft	Non-exit on Failed Initialization
456	Draft	Missing Initialization of a Variable
457	Draft	Use of Uninitialized Variable
458	Deprecated	DEPRECATED: Incorrect Initialization
459	Draft	Incomplete Cleanup
460	Draft	Improper Cleanup on Thrown Exception
462	Incomplete	Duplicate Key in Associative List (Alist)
463	Incomplete	Deletion of Data Structure Sentinel
464	Incomplete	Addition of Data Structure Sentinel
466	Draft	Return of Pointer Value Outside of Expected Range
467	Draft	Use of sizeof() on a Pointer Type
468	Incomplete	Incorrect Pointer Scaling
469	Draft	Use of Pointer Subtraction to Determine Size
470	Draft	Use of Externally-Controlled Input to Select Classes or Code ('Unsafe Reflection')
471	Draft	Modification of Assumed-Immutable Data (MAID)
472	Draft	External Control of Assumed-Immutable Web Parameter
473	Draft	PHP External Variable Modification
474	Draft	Use of Function with Inconsistent Implementations
475	Incomplete	Undefined Behavior for Input to API
476	Stable	NULL Pointer Dereference
477	Draft	Use of Obsolete Function
478	Draft	Missing Default Case in Switch Statement
479	Draft	Signal Handler Use of a Non-reentrant Function
480	Draft	Use of Incorrect Operator
481	Draft	Assigning instead of Comparing
482	Draft	Comparing instead of Assigning
483	Draft	Incorrect Block Delimitation
484	Draft	Omitted Break Statement in Switch
486	Draft	Comparison of Classes by Name
487	Incomplete	Reliance on Package-level Scope
488	Draft	Exposure of Data Element to Wrong Session
489	Draft	Active Debug Code
491	Draft	Public cloneable() Method Without Final ('Object Hijack')
492	Draft	Use of Inner Class Containing Sensitive Data
493	Draft	Critical Public Variable Without Final Modifier
494	Draft	Download of Code Without Integrity Check
495	Draft	Private Data Structure Returned From A Public Method
496	Incomplete	Public Data Assigned to Private Array-Typed Field
497	Incomplete	Exposure of Sensitive System Information to an Unauthorized Control Sphere
498	Draft	Cloneable Class Containing Sensitive Information
499	Draft	Serializable Class Containing Sensitive Data
500	Draft	Public Static Field Not Marked Final
501	Draft	Trust Boundary Violation
502	Draft	Deserialization of Untrusted Data
506	Incomplete	Embedded Malicious Code
507	Incomplete	Trojan Horse
508	Incomplete	Non-Replicating Malicious Code
509	Incomplete	Replicating Malicious Code (Virus or Worm)
510	Incomplete	Trapdoor
511	Incomplete	Logic/Time Bomb
512	Incomplete	Spyware
514	Incomplete	Covert Channel
515	Incomplete	Covert Storage Channel
516	Deprecated	DEPRECATED (Duplicate): Covert Timing Channel
520	Incomplete	.NET Misconfiguration: Use of Impersonation
521	Draft	Weak Password Requirements
522	Incomplete	Insufficiently Protected Credentials
523	Incomplete	Unprotected Transport of Credentials
524	Incomplete	Use of Cache Containing Sensitive Information
525	Incomplete	Use of Web Browser Cache Containing Sensitive Information
526	Incomplete	Exposure of Sensitive Information Through Environmental Variables
527	Incomplete	Exposure of Version-Control Repository to an Unauthorized Control Sphere
528	Draft	Exposure of Core Dump File to an Unauthorized Control Sphere
529	Incomplete	Exposure of Access Control List Files to an Unauthorized Control Sphere
530	Incomplete	Exposure of Backup File to an Unauthorized Control Sphere
531	Incomplete	Inclusion of Sensitive Information in Test Code
532	Incomplete	Insertion of Sensitive Information into Log File
533	Deprecated	DEPRECATED: Information Exposure Through Server Log Files
534	Deprecated	DEPRECATED: Information Exposure Through Debug Log Files
